<?xml version="1.0" encoding="utf-8"?>
<!DOCTYPE text_database SYSTEM "static_text_database.dtd">
<!-- Caution: This document contains Unicode characters above
              the ASCII range. Save as "binary" in CVS and
              be careful with text editors.


     Each entry must provide the language-appropriate white space before or
     after a term when it is used in context where more complex strings are
     constructed from multiple generated text bits, such as cross references.
  -->
<text_database xmlns="http://www.innodata-isogen.com/vocabularies/i18n_support/static_text_database">
  <metadata>
    <title>Sample Static Text Database</title>
    <description>
      <p>This is a sample static text database.</p>
    </description>
    <copyright>
      <p>Copyright (C) 2003, 2004 Innodata Isogen</p>
      <p>This sample may be used to create derivative text databases without restriction.</p>
    </copyright>
    <security>
      <p>For Public Use</p>
    </security>
    <revision_history>
      <revision>
        <date>2003-03-24</date>
        <author>W. Eliot Kimber, ISOGEN Internation, LLC</author>
        <description>
          <p>Created initial sample of static text database.</p>
          <p>All the text samples were translated using the AltaVista babel fish service (http://babelfish.altavista.com/babelfish/tr).</p>
        </description>
      </revision>
    </revision_history>
  </metadata>
  <contexts_common>
    <context>
      <lookup_key>#contents</lookup_key>
      <text_before>
        <default_item>{#contents not translated}</default_item>
        <item xml:lang="en">Contents</item>
        <item xml:lang="ar">المحتويات</item>
        <item xml:lang="de">Inhalt</item>
        <item xml:lang="fr">Sommaire</item>
        <item xml:lang="fi">Sisältö</item>
        <item xml:lang="da">Indholdsfortegnelse</item>
        <item xml:lang="no">Innhold</item>
        <item xml:lang="nl">Inhoudsopgave</item>
        <item xml:lang="it">Indice</item>
        <item xml:lang="es">Índice</item>
        <item xml:lang="pt">Índice</item>
        <item xml:lang="el">Περιεχόμενα</item>
        <item xml:lang="pl">Spis treści</item>
        <item xml:lang="ru">Содержание</item>
        <item xml:lang="cs">Obsah</item>
        <item xml:lang="hu">Tartalom</item>
        <item xml:lang="tr">İçindekiler</item>
        <item xml:lang="fr-CA">Sommaire</item>
        <item xml:lang="sv">Innehåll</item>
        <item xml:lang="pt-BR">Sumário</item>
        <item xml:lang="es-LAM">Contenido</item>
        <item xml:lang="bg">Съдържание</item>
        <item xml:lang="et">Sisukord</item>
        <item xml:lang="he">תוכן</item>
        <item xml:lang="hr">Sadržaj</item>
        <item xml:lang="is">Efnisyfirlit</item>
        <item xml:lang="lt">Turinys</item>
        <item xml:lang="lv">Saturs</item>
        <item xml:lang="ro">Cuprins</item>
        <item xml:lang="sk">Obsah</item>
        <item xml:lang="sl">Vsebina</item>
        <item xml:lang="sr-LAT">Sadržaj</item>
        <item xml:lang="sr-CYR">Садржај</item>
        <item xml:lang="uk">Зміст</item>
        <item xml:lang="af">Inhoud</item>
        <item xml:lang="fa">فهرست مطالب</item>
        <item xml:lang="hi"/>
        <item xml:lang="id">Daftar Isi</item>
        <item xml:lang="ja"/>
        <item xml:lang="km"/>
        <item xml:lang="ko"/>
        <item xml:lang="ms"/>
        <item xml:lang="sh"/>
        <item xml:lang="st">Dikahare</item>
        <item xml:lang="sw">Yaliyomo</item>
        <item xml:lang="th">สารบัญ</item>
        <item xml:lang="tl">Mga Nilalaman</item>
        <item xml:lang="ur">فہرست اجزا</item>
        <item xml:lang="vi">Muûc luûc</item>
        <item xml:lang="xh">IsiQulatho</item>
        <item xml:lang="zh-CN">目录</item>
        <item xml:lang="zh-HK">目錄</item>
        <item xml:lang="zh-TW">目錄</item>
        <item xml:lang="zu">Okuqukethwe</item>
      </text_before>
      <text_after/>
    </context>
    <context>
      <lookup_key>#index</lookup_key>
      <text_before>
        <default_item>{Index not translated}</default_item>
        <item xml:lang="en">Index</item>
        <item xml:lang="ar">الفهرس</item>
        <item xml:lang="tl">Indeks</item>
        <item xml:lang="de">Index</item>
        <item xml:lang="fr">Index</item>
        <item xml:lang="fi">Hakemisto</item>
        <item xml:lang="da">Indeks</item>
        <item xml:lang="no">Stikkordregister</item>
        <item xml:lang="nl">Index</item>
        <item xml:lang="it">Indice analitico</item>
        <item xml:lang="es">Índice alfabético</item>
        <item xml:lang="pt">Índice remissivo</item>
        <item xml:lang="el">Ευρετήριο</item>
        <item xml:lang="pl">Indeks</item>
        <item xml:lang="ru">Алфавитный указатель</item>
        <item xml:lang="cs">Rejstřík</item>
        <item xml:lang="hu">Mutató</item>
        <item xml:lang="tr">Dizin</item>
        <item xml:lang="fr-CA">Index</item>
        <item xml:lang="sv">Index</item>
        <item xml:lang="pt-BR">Índice</item>
        <item xml:lang="es-LAM">Índice</item>
        <item xml:lang="bg">Индекс</item>
        <item xml:lang="et">Register</item>
        <item xml:lang="he">אינדקס</item>
        <item xml:lang="hr">Kazalo</item>
        <item xml:lang="is">Atriðaskrá</item>
        <item xml:lang="lt">Rodyklė</item>
        <item xml:lang="lv">Alfabētiskais rādītājs</item>
        <item xml:lang="ro">Index</item>
        <item xml:lang="sk">Register</item>
        <item xml:lang="sl">Kazalo</item>
        <item xml:lang="sr-LAT">Indeks</item>
        <item xml:lang="sr-CYR">Индекс</item>
        <item xml:lang="uk">Покажчик</item>
        <item xml:lang="af">Indeks</item>
        <item xml:lang="fa">فهرست</item>
        <item xml:lang="hi"/>
        <item xml:lang="id">Indeks</item>
        <item xml:lang="ja"/>
        <item xml:lang="km"/>
        <item xml:lang="ko"/>
        <item xml:lang="ms"/>
        <item xml:lang="sh"/>
        <item xml:lang="st">Indekse</item>
        <item xml:lang="sw">Faharasa</item>
        <item xml:lang="th">ดัชนี</item>
        <item xml:lang="tl">Indise</item>
        <item xml:lang="ur">انڈيکس</item>
        <item xml:lang="vi">Tæì muûc</item>
        <item xml:lang="xh">Isalathisi</item>
        <item xml:lang="zh-CN">索引</item>
        <item xml:lang="zh-HK">索引</item>
        <item xml:lang="zh-TW">索引</item>
        <item xml:lang="zu">Izikhombo</item>
      </text_before>
      <text_after/>
    </context>
    <context>
      <lookup_key>#glossary</lookup_key>
      <text_before>
        <default_item>{glossary not translated}</default_item>
        <item xml:lang="en">Glossary</item>
        <item xml:lang="ar">قاموس المصطلحات</item>
        <item xml:lang="de">Glossar</item>
        <item xml:lang="fr">Glossaire</item>
        <item xml:lang="fi">Sanasto</item>
        <item xml:lang="da">Ordliste</item>
        <item xml:lang="no">Ordliste</item>
        <item xml:lang="nl">Woordenlijst</item>
        <item xml:lang="it">Glossario</item>
        <item xml:lang="es">Glosario</item>
        <item xml:lang="pt">Glossário</item>
        <item xml:lang="el">Γλωσσάριο</item>
        <item xml:lang="pl">Słownik</item>
        <item xml:lang="ru">Глоссарий</item>
        <item xml:lang="cs">Glosář</item>
        <item xml:lang="hu">Szójegyzék</item>
        <item xml:lang="tr">Sözlük</item>
        <item xml:lang="fr-CA">Glossaire</item>
        <item xml:lang="sv">Ordlista</item>
        <item xml:lang="pt-BR">Glossário</item>
        <item xml:lang="es-LAM">Glosario</item>
        <item xml:lang="bg">Речник</item>
        <item xml:lang="et">Mõisted</item>
        <item xml:lang="he">מילון מונחים</item>
        <item xml:lang="hr">Rječnik</item>
        <item xml:lang="is">Orðalisti</item>
        <item xml:lang="lt">Terminų paaiškinimai</item>
        <item xml:lang="lv">Skaidrojošā vārdnīca</item>
        <item xml:lang="ro">Glosar</item>
        <item xml:lang="sk">Výklad termínov</item>
        <item xml:lang="sl">Slovarček</item>
        <item xml:lang="sr-LAT">Glosar</item>
        <item xml:lang="sr-CYR">Глосар</item>
        <item xml:lang="uk">Глосарій</item>
        <item xml:lang="af">Woordelys</item>
        <item xml:lang="fa">واژه نامه</item>
        <item xml:lang="hi"/>
        <item xml:lang="id">Daftar istilah</item>
        <item xml:lang="ja"/>
        <item xml:lang="km"/>
        <item xml:lang="ko"/>
        <item xml:lang="ms"/>
        <item xml:lang="sh"/>
        <item xml:lang="st">Pokello ya mantswe</item>
        <item xml:lang="sw">Maneno Yaliyotumika</item>
        <item xml:lang="th">อภิธานศัพท์</item>
        <item xml:lang="tl">Glosaryo</item>
        <item xml:lang="ur">فہرست مصطلحات</item>
        <item xml:lang="vi">Baíng chuï giaíi</item>
        <item xml:lang="xh">Uluhlu lwamagama</item>
        <item xml:lang="zh-CN">词汇</item>
        <item xml:lang="zh-HK">詞彙表</item>
        <item xml:lang="zh-TW">詞彙</item>
        <item xml:lang="zu">Uhla Lwamagama</item>
      </text_before>
      <text_after/>
    </context>
    <context>
      <lookup_key>#all-rights-reserved</lookup_key>
      <text_before>
        <default_item>{#all-rights-reserved not translated}</default_item>
        <item xml:lang="en">ThreeInitialCorp. All rights reserved.</item>
        <item xml:lang="ar">ThreeInitialCorp جميع الحقوق محفوظة.</item>
        <item xml:lang="de">ThreeInitialCorp. Alle Rechte vorbehalten.</item>
        <item xml:lang="fr">ThreeInitialCorp. Tous droits réservés.</item>
        <item xml:lang="fi">ThreeInitialCorp. Kaikki oikeudet pidätetään.</item>
        <item xml:lang="da">ThreeInitialCorp. Alle rettigheder forbeholdes.</item>
        <item xml:lang="no">ThreeInitialCorp. Alle rettigheter forbeholdt.</item>
        <item xml:lang="nl">ThreeInitialCorp. Alle rechten voorbehouden.</item>
        <item xml:lang="it">ThreeInitialCorp. Tutti i diritti sono riservati.</item>